{
	"model": "CNN",
	"preprocessing": "greyscale",
	"augmentation": "default",
	"optimizer": {
		"name": "Adam",
		"lr": 0.001
	},
	"loss": "CrossEntropyLoss",
	"scheduler": {
		"name": "StepLR",
		"step_size": 10,
		"gamma": 0.5
	},
	"training": {
		"batch_size": 32,
		"num_epochs": 30,
		"patience": 5,
		"resume_from_checkpoint": false,
		"checkpoint_path": "export/weights/checkpoint.pth"
	},
	"paths": {
		"train_dir": "data/pulito/train",
		"test_dir": "data/pulito/test",
		"weight_dir": "export/weights"
	},
	"logging": {
		"name": "tensorboard",
		"log_dir": "runs/rps_experiment"
	}
}
