{
    "model": "ResNet",
    "preprocessing": "hsv",
    "augmentation": "default",
    "optimizer": {
        "name": "Adam",
        "lr": 0.001
    },
    "loss": "CrossEntropyLoss",
    "scheduler": {
        "name": "StepLR",
        "step_size": 10,
        "gamma": 0.5
    },
    "training": {
        "batch_size": 32,
        "num_epochs": 30,
        "patience": 5,
        "resume_from_checkpoint": false,
        "checkpoint_path": "export/weights/checkpoint.pth",
        "grad_clip": 2.0
    },
    "paths": {
        "train_dir": "data/misto/train",
        "test_dir": "data/misto/test",
        "weight_dir": "export/weights"
    },
    "logging": {
        "name": "tensorboard",
        "log_dir": "runs/rps_experiment",
        "dashboard_enabled": false
    }
}